Title;Description;GraphicURL;MediaType;ParallaxStrength;Link1;Link1Text;Link2;Link2Text;Layer1;Layer2;Layer3;Layer4;Layer5
AquaVentus at the North Sea Summit;AquaVentus demands: Think offshore wind and hydrogen together consistently, remove obstacles, accelerate electrolysis expansion.;https://aquaventus.org/wp-content/uploads/2026/01/Bildschirmfoto-2026-01-26-um-11.26.46-1.png;image;20;https://aquaventus.org/pressemeldungen/aquaventus-zum-north-sea-summit-worten-muessen-jetzt-taten-folgen/;To the Press Release;;;https://raw.githubusercontent.com/Meymeymey/aqua-bilder/main/0.png;https://raw.githubusercontent.com/Meymeymey/aqua-bilder/main/1.png;https://raw.githubusercontent.com/Meymeymey/aqua-bilder/main/2.png;https://raw.githubusercontent.com/Meymeymey/aqua-bilder/main/3.png;
Improve NEP;Berlin, January 15, 2026. The currently submitted draft of the Grid Development Plan (NEP) by the transmission system operators (TSOs) does not meet the requirements of a modern energy system and endangers Germany as an industrial location.;https://aquaventus.org/wp-content/uploads/2026/01/NEP-1.png;image;20;https://aquaventus.org/pressemeldungen/bundesnetzagentur-muss-vorgelegten-netzentwicklungsplan-dringend-aendern/;Learn more;;;;;;;
Consultation on the Wind Energy Amendment;Hydrogen industry urges combined connection concepts and warns of compensation claims;https://aquaventus.org/wp-content/uploads/2026/01/consultation.png;image;20;https://aquaventus.org/pressemeldungen/konsultation-zur-windenergie-novelle-wasserstoffwirtschaft-draengt-auf-kombinierte-anschlusskonzepte-und-warnt-vor-schadensersatzforderungen/;Learn more;;;;;;;
New study by Frontier Economics shows:;System costs can be reduced by up to 1.7 billion per year through offshore sector coupling;https://aquaventus.org/wp-content/uploads/2025/11/Screenshot-2025-11-12-at-14.22.25.png;image;20;https://aquaventus.org/pressemeldungen/sektorenkopplung_senkt_systemkosten/;Learn more;;;;;;;
Strengthen Network;Between warm candlelight and lively conversations, connections emerged that go far beyond the business framework. An evening that showed: Behind the projects and strategies are people who share a common vision with passion and conviction.;https://aquaventus.org/wp-content/uploads/2026/01/7IV04902-Verbessert-RR-scaled.jpg;image;20;;;;;;;;;
